{"achieved_claim":"STRICT_TELEMETRY_ONLY","adapter":"openai_chat_completions","blocked_reasons":[],"boundary_mode":"TELEMETRY_ONLY","claim_levels_evaluated":["BOUNDARY_FAILED","RAW_DOCUMENT_ABSENT","STRICT_TELEMETRY_ONLY"],"filing_derived_text_present":false,"findings":[],"manifest_version":"airlock.v0","model_id":"gpt-5","policy_hash":"blake3:bccf2508420d83910bb57553eba079825d7fb6ce0bf76d4ad1deebc4e2d2710f","policy_id":"clean_telemetry_only","prompt_payload_hash":"blake3:1461e14b6ef014affc1923e128c698094052c0602856c8f3ffcb29fd8f1e069f","prompt_provenance_hash":"blake3:5678464603e92df5aa249a8a9047926181cd92b74ca3eb486e372518da183b75","prompt_provenance_ref":"fixtures/clean_telemetry_only/expected_prompt_provenance.json","provenance_summary":{"by_boundary_class":{"TELEMETRY":18},"total_fragments":18},"raw_document_present":false,"replay_ref":"fixtures/clean_telemetry_only/request.json","request_payload_hash":"blake3:6e49bd3dcaa5a97f6fff127006ab6d44d820c6863078f736a4d566fed9fe7085","system_prompt_hash":"blake3:7b938e7f5e7db5daeca0d61f82144a130980f996c2f2e722cf7e381b25a0387f","timestamp":"2026-03-26T15:53:43.876049+00:00","upstream_artifact_inventory":[{"artifact_class":"telemetry","content_hash":"blake3:40f47b8e75d040d4585ac177ed7720556d5485064cfd602239b97970aab85adf","path":"template.messages[0].role"},{"artifact_class":"telemetry","content_hash":"blake3:5f6d3989c7fb86d3c961c0b217cb3b4939cff7416ed8980a18c7e662ec3e0761","path":"template.messages[1].role"},{"artifact_class":"telemetry","content_hash":"blake3:7b938e7f5e7db5daeca0d61f82144a130980f996c2f2e722cf7e381b25a0387f","path":"system_prompt"},{"artifact_class":"telemetry","content_hash":"blake3:b2e21222698fd835177577f184dcc7d5d65384e5a89d3aab43376094a8c926f1","path":"family_id"}]}