{"achieved_claim":"RAW_DOCUMENT_ABSENT","adapter":"openai_chat_completions","blocked_reasons":[{"claim_attempted":"STRICT_TELEMETRY_ONLY","offending_paths":["messages[1].content.mutator_context.challenge_observation","messages[1].content.mutator_context.challenge_profile.header_surfaces[0]","messages[1].content.mutator_context.challenge_profile.layout_notes[0]"],"reason":"filing-derived text crossed the boundary"}],"boundary_mode":"ANNOTATED","claim_levels_evaluated":["BOUNDARY_FAILED","RAW_DOCUMENT_ABSENT","STRICT_TELEMETRY_ONLY"],"filing_derived_text_present":true,"findings":[{"artifact_class":"derived_text_field_hit","key_path":"messages[1].content.mutator_context.challenge_observation","matched_rule":"derived_text_paths[0]","sample_value":"Dense footnotes in note disclosures require careful row grouping."},{"artifact_class":"derived_text_field_hit","key_path":"messages[1].content.mutator_context.challenge_profile.header_surfaces[0]","matched_rule":"derived_text_paths[1]","sample_value":"Schedule of investments header spans three visual rows."},{"artifact_class":"derived_text_field_hit","key_path":"messages[1].content.mutator_context.challenge_profile.layout_notes[0]","matched_rule":"derived_text_paths[2]","sample_value":"Totals appear in a right-aligned stub column after each sector break."}],"manifest_version":"airlock.v0","model_id":"gpt-5","policy_hash":"blake3:7cfdb5f69860a31338e9a9f45aed228a3645cb3e2a6699401df0d9229871d677","policy_id":"annotated_mode","prompt_payload_hash":"blake3:9680e18834ed82905325b6987387672578d8d7a504608c52cd4b4321d7edca9c","prompt_provenance_hash":"blake3:78f5da97415f56a3cdaf8a0c814a96c450eaf0bd6c6bf46413ab676e919e65a9","prompt_provenance_ref":"fixtures/annotated_mode/expected_prompt_provenance.json","provenance_summary":{"by_boundary_class":{"DERIVED_TEXT":3,"TELEMETRY":18},"total_fragments":21},"raw_document_present":false,"replay_ref":"fixtures/annotated_mode/request.json","request_payload_hash":"blake3:1f57b8f023f62a5f0ccb90e0920b3c23116fb6825c3fb8087f3463667da889f8","system_prompt_hash":"blake3:fd92fbd05d1c36e00ff4137a1548520eeaa63e123bada3575f8ff2d16f773f5c","timestamp":"2026-03-26T15:53:44.505444+00:00","upstream_artifact_inventory":[{"artifact_class":"telemetry","content_hash":"blake3:40f47b8e75d040d4585ac177ed7720556d5485064cfd602239b97970aab85adf","path":"template.messages[0].role"},{"artifact_class":"telemetry","content_hash":"blake3:5f6d3989c7fb86d3c961c0b217cb3b4939cff7416ed8980a18c7e662ec3e0761","path":"template.messages[1].role"},{"artifact_class":"telemetry","content_hash":"blake3:7f1fda7875ce52060297be56ccde65cf7643d682e9b909d01f54f722da4fa2c9","path":"family_id"},{"artifact_class":"telemetry","content_hash":"blake3:fd92fbd05d1c36e00ff4137a1548520eeaa63e123bada3575f8ff2d16f773f5c","path":"system_prompt"}]}